{
  "schema_version": "1.0.0",
  "authorization_gate": "HUMAN_NY_OSC_OWNER_NAME_FILE_FIRST_DOWNLOAD_TRANSIENT_PII_AUTHORIZATION",
  "owner_authorization": "APPROVO NY OSC OWNER NAME FILE FIRST DOWNLOAD TRANSIENT PII BOUNDED ONCE",
  "granted_on": "2026-09-18",
  "execution_approval_ref": "OWNER_APPROVAL_2026-09-18_NY_OSC_FIRST_DOWNLOAD_TRANSIENT_PII_BOUNDED_ONCE_A7D4C2F1",
  "status": "GRANTED_NOT_CONSUMED",
  "single_use": true,
  "reusable": false,
  "retry_authorized": false,
  "source_identity": {
    "expected_remote_listing_name": "FINDERS.zip",
    "expected_size_display": "390.51 MB",
    "expected_last_modified_display": "9/16/2026, 1:33:31 PM",
    "preflight_identity_match_required": true,
    "identity_drift_behavior": "STOP_BEFORE_DOWNLOAD_REQUIRE_FRESH_REVIEW"
  },
  "execution_bounds": {
    "downloads_max": 1,
    "retries_max": 0,
    "max_download_bytes": 450000000,
    "max_uncompressed_bytes": 2000000000,
    "max_archive_members": 1,
    "text_members_required_exactly": 1,
    "expected_delimiter": "|",
    "expected_documented_field_count": 14
  },
  "transient_local_file_exception": {
    "required": true,
    "approval_path": "sources/evidence/ny_osc_owner_name_file_transient_local_file_approval.v1.json",
    "approval_status_required": "GRANTED_NOT_CONSUMED",
    "expected_filename": "FINDERS.zip",
    "dedicated_temp_directory_prefix": "unclaimed-ny-osc-gate2-",
    "durable_raw_persistence_allowed": false,
    "repository_persistence_allowed": false,
    "cloud_sync_allowed": false,
    "chat_upload_allowed": false,
    "immediate_logical_deletion_required": true,
    "physical_secure_erasure_guaranteed": false
  },
  "processing_scope": {
    "transient_owner_pii_in_memory_allowed": true,
    "raw_file_persistence_beyond_temp_execution_allowed": false,
    "owner_rows_persistence_allowed": false,
    "owner_field_logging_allowed": false,
    "row_specific_human_inspection_allowed": false,
    "derived_non_pii_schema_metadata_persistence_allowed": true
  },
  "authorization_does_not_grant": {
    "source_activation": false,
    "production_classification_activation": false,
    "beneficiary_matching": false,
    "identity_resolution": false,
    "outreach": false,
    "fee_agreement": false,
    "representation": false,
    "claim_activity": false
  }
}
